### ISSUE TITLE
netty client get RST from server

### ISSUE THREAD

**Issue by zvinlong** [netty/netty#6673]
### Actual behavior
netty http client get RST from server.But apache http client request is ok;

tcpdump is：
client ->[S] server
client <-[S] server
client ->[ack] server
client ->[P] server
client <-[R] server

I confirm the data package is ok.But I don't know why server return RST,and how netty to deal with RST(just deal as read).

### Netty version
4.1.9
### JVM version (e.g. `java -version`)
1.8
### OS version (e.g. `uname -a`)
mac/linux

**Comment by normanmaurer** [comment]
@zvinlong if you get an RST you will see an `IOException()` which will have a message like "connection reset".

**Comment by zvinlong** [comment]
I know that and i sure get IOException with msg like "connection reset by peer". 
But I need to success to finish this request althought I got a RST.Because I can use apache httpClient to reach that. 
There is three success scenes in  apache httpClient:
1、no RST return by  server;
2、client get RST but resend a SEW tcp package to finish request with another tcp request;
3、get F tcp status before receive data but is ok.

```
11:29:56.417268 IP 30.15.70.90.53252 > 58.32.246.121.http: Flags [S], seq 1588772198, win 65535, options [mss 1460,nop,wscale 5,nop,nop,TS val 1375390015 ecr 0,sackOK,eol], length 0
11:29:56.427674 IP 58.32.246.121.http > 30.15.70.90.53252: Flags [S.], seq 783879653, ack 1588772199, win 4380, options [mss 1460,nop,wscale 0,nop,nop,TS val 2823744770 ecr 1375390015,sackOK,eol], length 0
11:29:56.427760 IP 30.15.70.90.53252 > 58.32.246.121.http: Flags [.], ack 1, win 4117, options [nop,nop,TS val 1375390025 ecr 2823744770], length 0
11:29:56.518584 IP 30.15.70.90.53252 > 58.32.246.121.http: Flags [P.], seq 1:279, ack 1, win 4117, options [nop,nop,TS val 1375390114 ecr 2823744770], length 278: HTTP: POST http://ordwstb.yto56.com.cn/ordwstaobao/TaoBao14NewServlet HTTP/1.1
11:29:56.530348 IP 58.32.246.121.http > 30.15.70.90.53252: Flags [R.], seq 1, ack 279, win 4658, length 0
15:33:11.749762 IP 30.15.70.90.58567 > 58.32.246.121.http: Flags [SEW], seq 1124343202, win 65535, options [mss 1460,nop,wscale 5,nop,nop,TS val 1389870585 ecr 0,sackOK,eol], length 0
15:33:11.762267 IP 58.32.246.121.http > 30.15.70.90.58567: Flags [S.], seq 2113788217, ack 1124343203, win 4380, options [mss 1460,nop,wscale 0,nop,nop,TS val 2838340129 ecr 1389870585,sackOK,eol], length 0
15:33:11.762340 IP 30.15.70.90.58567 > 58.32.246.121.http: Flags [.], ack 1, win 4117, options [nop,nop,TS val 1389870597 ecr 2838340129], length 0
15:33:11.810558 IP 30.15.70.90.58567 > 58.32.246.121.http: Flags [P.], seq 1:306, ack 1, win 4117, options [nop,nop,TS val 1389870645 ecr 2838340129], length 305: HTTP: POST /ordwstaobao/TaoBao14NewServlet HTTP/1.1
15:33:11.825447 IP 58.32.246.121.http > 30.15.70.90.58567: Flags [F.], seq 422, ack 306, win 4685, options [nop,nop,TS val 2838340192 ecr 1389870645], length 0
15:33:11.825451 IP 58.32.246.121.http > 30.15.70.90.58567: Flags [P.], seq 1:417, ack 306, win 4685, options [nop,nop,TS val 2838340192 ecr 1389870645], length 416: HTTP: HTTP/1.1 200 OK
15:33:11.825453 IP 58.32.246.121.http > 30.15.70.90.58567: Flags [P.], seq 417:422, ack 306, win 4685, options [nop,nop,TS val 2838340192 ecr 1389870645], length 5: HTTP
15:33:11.825524 IP 30.15.70.90.58567 > 58.32.246.121.http: Flags [.], ack 1, win 4117, options [nop,nop,TS val 1389870659 ecr 2838340129], length 0
15:33:11.825742 IP 30.15.70.90.58567 > 58.32.246.121.http: Flags [.], ack 417, win 4104, options [nop,nop,TS val 1389870659 ecr 2838340192], length 0
15:33:11.825793 IP 30.15.70.90.58567 > 58.32.246.121.http: Flags [.], ack 423, win 4104, options [nop,nop,TS val 1389870659 ecr 2838340192], length 0
15:33:11.847445 IP 30.15.70.90.58567 > 58.32.246.121.http: Flags [F.], seq 306, ack 423, win 4104, options [nop,nop,TS val 1389870679 ecr 2838340192], length 0
15:33:11.860733 IP 58.32.246.121.http > 30.15.70.90.58567: Flags [.], ack 307, win 4685, options [nop,nop,TS val 2838340227 ecr 1389870679], length 0

```
