### ISSUE TITLE
Querying ENUM DNS over TCP doesn't work

### ISSUE THREAD

**Issue by ljevik** [netty/netty#10977]
### Expected behavior
Valid ANSWER is returned

### Actual behavior
DefaultDnsResponse(8625, QUERY(0), Refused(5)) is returned

### Steps to reproduce
1. We are resolving ENUM information for phone numbers over TCP.
2. There is a proxy server installed behind ha-proxy (port 10053), which is able to forward ENUM queries to our providers.
3. Example query (last 6 digits are replaced with X):
```
dig +tcp -t naptr @127.0.0.1 -p 10053 X.X.X.X.X.X.8.0.7.6.4.e164enum.net

; <<>> DiG 9.8.2rc1-RedHat-9.8.2-0.68.rc1.64.amzn1 <<>> +tcp -t naptr @127.0.0.1 -p 10053 X.X.X.X.X.X.8.0.7.6.4.e164enum.net
; (1 server found)
;; global options: +cmd
;; Got answer:
;; ->>HEADER<<- opcode: QUERY, status: NOERROR, id: 38112
;; flags: qr rd ra; QUERY: 1, ANSWER: 1, AUTHORITY: 1, ADDITIONAL: 0

;; QUESTION SECTION:
;X.X.X.X.X.X.8.0.7.6.4.e164enum.net. IN	NAPTR

;; ANSWER SECTION:
X.X.X.X.X.X.8.0.7.6.4.e164enum.net. 900	IN NAPTR 10 50 "u" "E2U+pstn:tel" "!^(.*)$!tel:\\1\;npdi\;mcc=240\;mnc=08\" .

;; AUTHORITY SECTION:
X.X.X.X.X.X.8.0.7.6.4.e164enum.net. 900	IN SOA	<redacted> 2003080800 86400 7200 3600000 172800

;; Query time: 17 msec
;; SERVER: 127.0.0.1#10053(127.0.0.1)
;; WHEN: Fri Jan 29 00:34:34 2021
;; MSG SIZE  rcvd: 207
```
4. Use slightly modified TcpDnsClient from https://github.com/netty/netty/blob/4.1/example/src/main/java/io/netty/example/dns/tcp/TcpDnsClient.java
5. Response: `DefaultDnsResponse(8625, QUERY(0), Refused(5))`
6. Additionally: https://github.com/dnsjava/dnsjava works fine with resolver tcp=true, but unfortunately it has other issues, which prevent us from using it.

### Minimal yet complete reproducer code (or URL to code)
```
import io.netty.bootstrap.Bootstrap;
import io.netty.buffer.ByteBufUtil;

import io.netty.channel.Channel;
import io.netty.channel.ChannelInitializer;
import io.netty.channel.ChannelHandlerContext;
import io.netty.channel.ChannelPipeline;
import io.netty.channel.EventLoopGroup;
import io.netty.channel.nio.NioEventLoopGroup;
import io.netty.channel.socket.SocketChannel;
import io.netty.channel.socket.nio.NioSocketChannel;
import io.netty.channel.SimpleChannelInboundHandler;

import io.netty.handler.codec.dns.DefaultDnsQuestion;
import io.netty.handler.codec.dns.DefaultDnsResponse;
import io.netty.handler.codec.dns.DnsQuestion;
import io.netty.handler.codec.dns.DnsQuery;
import io.netty.handler.codec.dns.DefaultDnsQuery;
import io.netty.handler.codec.dns.DnsOpCode;
import io.netty.handler.codec.dns.DnsRecord;
import io.netty.handler.codec.dns.DnsSection;
import io.netty.handler.codec.dns.DnsRecordType;
import io.netty.handler.codec.dns.DnsRawRecord;
import io.netty.handler.codec.dns.TcpDnsQueryEncoder;
import io.netty.handler.codec.dns.TcpDnsResponseDecoder;
import io.netty.handler.logging.LogLevel;
import io.netty.handler.logging.LoggingHandler;
import io.netty.util.NetUtil;
import reactor.core.publisher.Mono;
import reactor.netty.tcp.TcpClient;
import reactor.netty.udp.UdpClient;

import java.util.Random;
import java.util.concurrent.TimeUnit;

public final class TestNetty {

    private static final String QUERY_DOMAIN = "X.X.X.X.X.X.8.0.7.6.4.e164enum.net";
    private static final int DNS_SERVER_PORT = 10053;
    private static final String DNS_SERVER_HOST = "127.0.0.1";


    private static void handleQueryResp(DefaultDnsResponse msg) {
        System.out.println("MESSAGE:" + msg)
        if (msg.count(DnsSection.QUESTION) > 0) {
            DnsQuestion question = msg.recordAt(DnsSection.QUESTION, 0);
            System.out.printf("name: %s%n", question.name());
        }
        for (int i = 0, count = msg.count(DnsSection.ANSWER); i < count; i++) {
            DnsRecord record = msg.recordAt(DnsSection.ANSWER, i);
            if (record.type() == DnsRecordType.NAPTR) {
                //just print the IP after query
                DnsRawRecord raw = (DnsRawRecord) record;
                System.out.println(NetUtil.bytesToIpAddress(ByteBufUtil.getBytes(raw.content())));
            }
        }
    }

    public static void main(String[] args) throws Exception {
        EventLoopGroup group = new NioEventLoopGroup();
        try {
            Bootstrap b = new Bootstrap();
            b.group(group)
                    .channel(NioSocketChannel.class)
                    .handler(new LoggingHandler(LogLevel.TRACE))
                    .handler(new ChannelInitializer<SocketChannel>() {
                        @Override
                        protected void initChannel(SocketChannel ch) {
                            ChannelPipeline p = ch.pipeline();
                            p.addLast(new TcpDnsQueryEncoder())
                                    .addLast(new TcpDnsResponseDecoder())
                                    .addLast(new SimpleChannelInboundHandler<DefaultDnsResponse>() {
                                        @Override
                                        protected void channelRead0(ChannelHandlerContext ctx, DefaultDnsResponse msg) {
                                            try {
                                                handleQueryResp(msg);
                                            } finally {
                                                ctx.close();
                                            }
                                        }
                                    });
                        }
                    });

            final Channel ch = b.connect(DNS_SERVER_HOST, DNS_SERVER_PORT).sync().channel();

            int randomID = new Random().nextInt(60000 - 1000) + 1000;
            DnsQuery query = new DefaultDnsQuery(randomID, DnsOpCode.QUERY)
                    .setRecord(DnsSection.QUESTION, new DefaultDnsQuestion(QUERY_DOMAIN, DnsRecordType.NAPTR));
            ch.writeAndFlush(query).sync();
            boolean success = ch.closeFuture().await(10, TimeUnit.SECONDS);
            if (!success) {
                System.err.println("dns query timeout!");
                ch.close().sync();
            }
        } finally {
            group.shutdownGracefully();
        }
    }
}
```

### Netty version
4.1.58.Final

### JVM version (e.g. `java -version`)
openjdk 11.0.8 2020-07-14 LTS
OpenJDK Runtime Environment Zulu11.41+24-SA (build 11.0.8+10-LTS)
OpenJDK 64-Bit Server VM Zulu11.41+24-SA (build 11.0.8+10-LTS, mixed mode)

### OS version (e.g. `uname -a`)
Linux ip-172-22-63-24 4.14.200-116.320.amzn1.x86_64 #1 SMP Tue Oct 13 10:39:58 UTC 2020 x86_64 x86_64 x86_64 GNU/Linux

**Comment by hyperxpro** [comment]
It's hard to reproduce without some testing server.

**Comment by ljevik** [comment]
Which options do I have to trace this? So far even though I've added `.handler(new LoggingHandler(LogLevel.TRACE))` there is no output in console.

**Comment by hyperxpro** [comment]
Use `PcapWriteHandler` and upload the `pcap` file.

**Comment by ljevik** [comment]
OK, also, if it helps, here is the tcp dump from the host:
**dig command:**
```
06:06:54.163701 IP (tos 0x0, ttl 255, id 60381, offset 0, flags [DF], proto TCP (6), length 60)
    127.0.0.1.38655 > 127.0.0.1.10053: Flags [S], cksum 0xfe30 (incorrect -> 0x891f), seq 2717009869, win 43690, options [mss 65495,sackOK,TS val 2814561352 ecr 0,nop,wscale 7], length 0
06:06:54.163709 IP (tos 0x0, ttl 255, id 0, offset 0, flags [DF], proto TCP (6), length 60)
    127.0.0.1.10053 > 127.0.0.1.38655: Flags [S.], cksum 0xfe30 (incorrect -> 0xd441), seq 818941937, ack 2717009870, win 43690, options [mss 65495,sackOK,TS val 2814561352 ecr 2814561352,nop,wscale 7], length 0
06:06:54.163716 IP (tos 0x0, ttl 255, id 60382, offset 0, flags [DF], proto TCP (6), length 52)
    127.0.0.1.38655 > 127.0.0.1.10053: Flags [.], cksum 0xfe28 (incorrect -> 0xa686), seq 1, ack 1, win 342, options [nop,nop,TS val 2814561352 ecr 2814561352], length 0
06:06:54.163934 IP (tos 0x0, ttl 255, id 60383, offset 0, flags [DF], proto TCP (6), length 106)
    127.0.0.1.38655 > 127.0.0.1.10053: Flags [P.], cksum 0xfe5e (incorrect -> 0x6ba5), seq 1:55, ack 1, win 342, options [nop,nop,TS val 2814561352 ecr 2814561352], length 54
06:06:54.163938 IP (tos 0x0, ttl 255, id 11242, offset 0, flags [DF], proto TCP (6), length 52)
    127.0.0.1.10053 > 127.0.0.1.38655: Flags [.], cksum 0xfe28 (incorrect -> 0xa650), seq 1, ack 55, win 342, options [nop,nop,TS val 2814561352 ecr 2814561352], length 0
06:06:54.164149 IP (tos 0x0, ttl 255, id 11243, offset 0, flags [DF], proto TCP (6), length 261)
    127.0.0.1.10053 > 127.0.0.1.38655: Flags [P.], cksum 0xfef9 (incorrect -> 0x3fc9), seq 1:210, ack 55, win 342, options [nop,nop,TS val 2814561352 ecr 2814561352], length 209
06:06:54.164155 IP (tos 0x0, ttl 255, id 60384, offset 0, flags [DF], proto TCP (6), length 52)
    127.0.0.1.38655 > 127.0.0.1.10053: Flags [.], cksum 0xfe28 (incorrect -> 0xa577), seq 55, ack 210, win 350, options [nop,nop,TS val 2814561352 ecr 2814561352], length 0
06:06:54.164522 IP (tos 0x0, ttl 255, id 60385, offset 0, flags [DF], proto TCP (6), length 52)
    127.0.0.1.38655 > 127.0.0.1.10053: Flags [F.], cksum 0xfe28 (incorrect -> 0xa575), seq 55, ack 210, win 350, options [nop,nop,TS val 2814561353 ecr 2814561352], length 0
06:06:54.164683 IP (tos 0x0, ttl 255, id 11244, offset 0, flags [DF], proto TCP (6), length 52)
    127.0.0.1.10053 > 127.0.0.1.38655: Flags [F.], cksum 0xfe28 (incorrect -> 0xa57b), seq 210, ack 56, win 342, options [nop,nop,TS val 2814561353 ecr 2814561353], length 0
06:06:54.164689 IP (tos 0x0, ttl 255, id 60386, offset 0, flags [DF], proto TCP (6), length 52)
    127.0.0.1.38655 > 127.0.0.1.10053: Flags [.], cksum 0xfe28 (incorrect -> 0xa573), seq 56, ack 211, win 350, options [nop,nop,TS val 2814561353 ecr 2814561353], length 0
```

**netty:**
```
06:07:33.343258 IP (tos 0x0, ttl 255, id 60359, offset 0, flags [DF], proto TCP (6), length 60)
    127.0.0.1.45340 > 127.0.0.1.10053: Flags [S], cksum 0xfe30 (incorrect -> 0x5f19), seq 3541273993, win 43690, options [mss 65495,sackOK,TS val 2814600531 ecr 0,nop,wscale 7], length 0
06:07:33.343270 IP (tos 0x0, ttl 255, id 0, offset 0, flags [DF], proto TCP (6), length 60)
    127.0.0.1.10053 > 127.0.0.1.45340: Flags [S.], cksum 0xfe30 (incorrect -> 0x8ab1), seq 3174763012, ack 3541273994, win 43690, options [mss 65495,sackOK,TS val 2814600531 ecr 2814600531,nop,wscale 7], length 0
06:07:33.343280 IP (tos 0x0, ttl 255, id 60360, offset 0, flags [DF], proto TCP (6), length 52)
    127.0.0.1.45340 > 127.0.0.1.10053: Flags [.], cksum 0xfe28 (incorrect -> 0x5cf6), seq 1, ack 1, win 342, options [nop,nop,TS val 2814600531 ecr 2814600531], length 0
06:07:33.409257 IP (tos 0x0, ttl 255, id 60361, offset 0, flags [DF], proto TCP (6), length 106)
    127.0.0.1.45340 > 127.0.0.1.10053: Flags [P.], cksum 0xfe5e (incorrect -> 0x04d9), seq 1:55, ack 1, win 342, options [nop,nop,TS val 2814600597 ecr 2814600531], length 54
06:07:33.409268 IP (tos 0x0, ttl 255, id 8109, offset 0, flags [DF], proto TCP (6), length 52)
    127.0.0.1.10053 > 127.0.0.1.45340: Flags [.], cksum 0xfe28 (incorrect -> 0x5c3c), seq 1, ack 55, win 342, options [nop,nop,TS val 2814600597 ecr 2814600597], length 0
06:07:33.409781 IP (tos 0x0, ttl 255, id 8110, offset 0, flags [DF], proto TCP (6), length 66)
    127.0.0.1.10053 > 127.0.0.1.45340: Flags [P.], cksum 0xfe36 (incorrect -> 0xbdda), seq 1:15, ack 55, win 342, options [nop,nop,TS val 2814600598 ecr 2814600597], length 14
06:07:33.409787 IP (tos 0x0, ttl 255, id 60362, offset 0, flags [DF], proto TCP (6), length 52)
    127.0.0.1.45340 > 127.0.0.1.10053: Flags [.], cksum 0xfe28 (incorrect -> 0x5c2c), seq 55, ack 15, win 342, options [nop,nop,TS val 2814600598 ecr 2814600598], length 0
06:07:33.446060 IP (tos 0x0, ttl 255, id 60363, offset 0, flags [DF], proto TCP (6), length 52)
    127.0.0.1.45340 > 127.0.0.1.10053: Flags [F.], cksum 0xfe28 (incorrect -> 0x5c07), seq 55, ack 15, win 342, options [nop,nop,TS val 2814600634 ecr 2814600598], length 0
06:07:33.446561 IP (tos 0x0, ttl 255, id 8111, offset 0, flags [DF], proto TCP (6), length 52)
    127.0.0.1.10053 > 127.0.0.1.45340: Flags [F.], cksum 0xfe28 (incorrect -> 0x5be1), seq 15, ack 56, win 342, options [nop,nop,TS val 2814600635 ecr 2814600634], length 0
06:07:33.446570 IP (tos 0x0, ttl 255, id 60364, offset 0, flags [DF], proto TCP (6), length 52)
    127.0.0.1.45340 > 127.0.0.1.10053: Flags [.], cksum 0xfe28 (incorrect -> 0x5be0), seq 56, ack 16, win 342, options [nop,nop,TS val 2814600635 ecr 2814600635], length 0
```

**Comment by ljevik** [comment]
Here is the pcap file (had to use "txt" extention, because github didn't allow to upload it with "pcap"): 
[dump.txt](https://github.com/netty/netty/files/5894339/dump.txt)

**Comment by hyperxpro** [comment]
![Screenshot (123)](https://user-images.githubusercontent.com/24762260/106346086-880edc80-62da-11eb-86e9-1edfd0ec09a1.png)

This is only what I can see in pcap file. The request was refused by server.

**Comment by hyperxpro** [comment]
Start Packet Capture with tcpdump and capture `dnsjava` query packet and `Netty` query packet. Upload both pcap files.

This will give me a hint if `Netty` has some bug or not.

**Comment by ljevik** [comment]
Please see attached netty.pcap, dnsjava.pcap and dnsjava.log files. Hope that helps.

Also, I discovered we are using following configuration for dnsjava:
```
    // Reset defaults of Lookup library in order to avoid default DNS lookups against global nameservers
    private static final String[] DOMAINS = {};
    static {
        try {
            Lookup.setDefaultSearchPath(DOMAINS);
            Lookup.setDefaultResolver(null);
        } catch (final TextParseException e) {
            log.warn("Unable to reset default search paths", e);
        }
    }
```
Is there something similar for Netty, which might affect lookups?

[dnsjava_log.txt](https://github.com/netty/netty/files/5903645/dnsjava_log.txt)
[dnsjava_pcap.txt](https://github.com/netty/netty/files/5903646/dnsjava_pcap.txt)
[netty_pcap.txt](https://github.com/netty/netty/files/5903647/netty_pcap.txt)

**Comment by hyperxpro** [comment]
OPT is not present in Netty query but present in `dnsjava` query. Payload size is not available in Netty request so the DNS server refuses the request.

![Screenshot (127)](https://user-images.githubusercontent.com/24762260/106454461-c6f68b00-64b0-11eb-87ab-9194f13737f5.png)

**Comment by hyperxpro** [comment]
Use this code to add OPT record.
```java
import io.netty.bootstrap.Bootstrap;
import io.netty.buffer.ByteBufUtil;
import io.netty.channel.Channel;
import io.netty.channel.ChannelHandlerContext;
import io.netty.channel.ChannelInitializer;
import io.netty.channel.ChannelPipeline;
import io.netty.channel.EventLoopGroup;
import io.netty.channel.SimpleChannelInboundHandler;
import io.netty.channel.nio.NioEventLoopGroup;
import io.netty.channel.socket.InternetProtocolFamily;
import io.netty.channel.socket.SocketChannel;
import io.netty.channel.socket.nio.NioSocketChannel;
import io.netty.handler.codec.dns.DefaultDnsOptEcsRecord;
import io.netty.handler.codec.dns.DefaultDnsQuery;
import io.netty.handler.codec.dns.DefaultDnsQuestion;
import io.netty.handler.codec.dns.DefaultDnsResponse;
import io.netty.handler.codec.dns.DnsOpCode;
import io.netty.handler.codec.dns.DnsQuery;
import io.netty.handler.codec.dns.DnsQuestion;
import io.netty.handler.codec.dns.DnsRawRecord;
import io.netty.handler.codec.dns.DnsRecord;
import io.netty.handler.codec.dns.DnsRecordType;
import io.netty.handler.codec.dns.DnsSection;
import io.netty.handler.codec.dns.TcpDnsQueryEncoder;
import io.netty.handler.codec.dns.TcpDnsResponseDecoder;
import io.netty.util.NetUtil;

import java.util.Random;
import java.util.concurrent.TimeUnit;

public final class TestNetty {

    private static final String QUERY_DOMAIN = "X.X.X.X.X.X.8.0.7.6.4.e164enum.net";
    private static final int DNS_SERVER_PORT = 53;
    private static final String DNS_SERVER_HOST = "8.8.8.8";


    private static void handleQueryResp(DefaultDnsResponse msg) {
        System.out.println("MESSAGE:" + msg);
        if (msg.count(DnsSection.QUESTION) > 0) {
            DnsQuestion question = msg.recordAt(DnsSection.QUESTION, 0);
            System.out.printf("name: %s%n", question.name());
        }
        for (int i = 0, count = msg.count(DnsSection.ANSWER); i < count; i++) {
            DnsRecord record = msg.recordAt(DnsSection.ANSWER, i);
            if (record.type() == DnsRecordType.NAPTR) {
                //just print the IP after query
                DnsRawRecord raw = (DnsRawRecord) record;
                System.out.println(NetUtil.bytesToIpAddress(ByteBufUtil.getBytes(raw.content())));
            }
        }
    }

    public static void main(String[] args) throws Exception {
        EventLoopGroup group = new NioEventLoopGroup();
        try {
            Bootstrap b = new Bootstrap();
            b.group(group)
                    .channel(NioSocketChannel.class)
                    .handler(new ChannelInitializer<SocketChannel>() {
                        @Override
                        protected void initChannel(SocketChannel ch) {
                            ChannelPipeline p = ch.pipeline();
                            p.addLast(new TcpDnsQueryEncoder())
                                    .addLast(new TcpDnsResponseDecoder())
                                    .addLast(new SimpleChannelInboundHandler<DefaultDnsResponse>() {
                                        @Override
                                        protected void channelRead0(ChannelHandlerContext ctx, DefaultDnsResponse msg) {
                                            try {
                                                handleQueryResp(msg);
                                            } finally {
                                                ctx.close();
                                            }
                                        }
                                    });
                        }
                    });

            final Channel ch = b.connect(DNS_SERVER_HOST, DNS_SERVER_PORT).sync().channel();

            int randomID = new Random().nextInt(60000 - 1000) + 1000;
            DnsQuery query = new DefaultDnsQuery(randomID, DnsOpCode.QUERY)
                    .setRecord(DnsSection.QUESTION, new DefaultDnsQuestion(QUERY_DOMAIN, DnsRecordType.NAPTR))
                    .setRecord(DnsSection.ADDITIONAL, new DefaultDnsOptEcsRecord(1248, InternetProtocolFamily.IPv4));

            ch.writeAndFlush(query).sync();
            boolean success = ch.closeFuture().await(10, TimeUnit.SECONDS);
            if (!success) {
                System.err.println("dns query timeout!");
                ch.close().sync();
            }
        } finally {
            group.shutdownGracefully();
        }
    }
}

```

**Comment by hyperxpro** [comment]
Netty is low level framework so you gotta do many things by your own. Hope it helps. 

Cheers! :)

**Comment by ljevik** [comment]
Thanks for the suggestion, but it still didn't work. See attached file.
[netty2.txt](https://github.com/netty/netty/files/5904419/netty2.txt)

**Comment by hyperxpro** [comment]
You've to play around with OPT more, I think. I don't have DNS server to test so can't fix that for you.

**Comment by hyperxpro** [comment]
@normanmaurer Our OPT does not have many functions. I am thinking to re-work on DNS module. How does it sound?

**Comment by ljevik** [comment]
@hyperxpro , thanks a lot for you help so far. Really appreciate it. In meanwhile I've been trying to compare how DNS records are created in Netty and dnsjava. I see that in dnsjava they are creating OPTRecord with name=root, i.e. `.`(a dot), 
```
  public OPTRecord(int payloadSize, int xrcode, int version, int flags, List<EDNSOption> options) {
    super(Name.root, Type.OPT, payloadSize, 0);
```
whereas in Netty `AbstractDnsOptPseudoRrRecord` is created with empty name, without possibility to change this. Is this something that can cause the problem? (though I've implemented my own OTPRecord based on `AbstractDnsRecord` and set name to `.` - it had no effect)
Otherwise there are not too many options to play around with. I used payloadSize=1280 - exactly the same as in dnjsava and other flags are set to 0.

Also, how can you see DNS packets in tcp dump from pcap files? In your screenshots "Protocol" column contains "DNS" for some packets and for me they are all "TCP" in wireshark and I can't analyze DNS query sections ther?

**Comment by hyperxpro** [comment]
Select the packet, right-click, decode as, choose DNS.

Netty is lacking some of OPT features.

**Comment by ljevik** [comment]
Finally got to the bottom of it (thanks for the wireshark tip): `.setRecursionDesired(true)` was missing. It works now as expected.
