### ISSUE TITLE
set autoRead(true), sometimes  Can't recover by myself

### ISSUE THREAD

**Issue by juebanlin** [netty/netty#11506]
### Netty version
4.1.65
### JVM version (e.g. `java -version`)
openjdk-11.0.11+9
### OS version (e.g. `uname -a`)
ubuntu 18.04

### desc
This problem is not easy to reproduce,
I have 8 clients connected to an exchange node for traffic interaction. After a few hours, there was a client connection that could not be read automatically, and the client could not be sent to the exchange node.

###  code
Because of business privacy issues, the code is similar to the following：
The atomicity is used to avoid repeated triggering for a period of time, and that part of the code is omitted.
```
        {
        boolean logicBusy=true;//some queue is full
        boolean logicIdle=true;//some queue is empty
        Channel channel=null;
        Consumer<Channel> recoveryRead=(ch)->{
            if(ch.config().isAutoRead()){
                log.warn("isAutoReaded:{}",ch);
                return;
            }
            ch.config().setAutoRead(true);
            log.warn("AutoRead open:{}",ch);
        };
        if(logicBusy){
            channel.eventLoop().submit(()->{
                if(!channel.config().isAutoRead()){
                    return;
                }
                channel.config().setAutoRead(false);
                //delay recovery
                channel.eventLoop().schedule(()->{recoveryRead.accept(channel);},5,TimeUnit.SECONDS);
                log.warn("AutoRead close:{}");
            });
        }
        if(logicIdle){
            log.warn("logicIdle:{}",channel);
            //Manual trigger recovery
            channel.eventLoop().submit(()->{
                recoveryRead.accept(channel);
            });
        }
    }
```

### last logs:
```
Omit duplicate logs ……
21-07-23 00:11:35.233 [ioworkers-s-14:55986197] WARN  AutoRead close:[id: 0x68a2f49d, L:/192.168.101.36:43030 - R:/192.168.101.34:35538]
21-07-23 00:11:37.889 [queue-worker-5:55988853] WARN  logicIdle:PushClientCode-Game-2007,channel:[id: 0x68a2f49d, L:/192.168.101.36:43030 - R:/192.168.101.34:35538]
21-07-23 00:11:37.889 [ioworkers-s-14:55988853] WARN  AutoRead open:[id: 0x68a2f49d, L:/192.168.101.36:43030 - R:/192.168.101.34:35538]
21-07-23 00:11:39.582 [ioworkers-s-14:55990546] WARN  AutoRead close:[id: 0x68a2f49d, L:/192.168.101.36:43030 - R:/192.168.101.34:35538]
21-07-23 00:11:42.579 [queue-worker-6:55993543] WARN  logicIdle:PushClientCode-Game-2007,channel:[id: 0x68a2f49d, L:/192.168.101.36:43030 - R:/192.168.101.34:35538]
21-07-23 00:11:42.579 [ioworkers-s-14:55993543] WARN  AutoRead open:[id: 0x68a2f49d, L:/192.168.101.36:43030 - R:/192.168.101.34:35538]
21-07-23 00:11:44.583 [ioworkers-s-14:55995547] WARN  isAutoReaded:[id: 0x68a2f49d, L:/192.168.101.36:43030 - R:/192.168.101.34:35538](delay trigger)
From here on, only read the log of timeout events
```

### tcpdump
```
tcpdump: verbose output suppressed, use -v or -vv for full protocol decode
listening on ens160, link-type EN10MB (Ethernet), capture size 262144 bytes
06:31:15.455876 IP switch.43030 > 192.168.101.34.35538: Flags [P.], seq 2199543396:2199543408, ack 1608845506, win 0, options [nop,nop,TS val 1187900344 ecr 1437623955], length 12
06:31:15.466058 IP 192.168.101.34.35538 > switch.43030: Flags [.], ack 12, win 2085, options [nop,nop,TS val 1437628939 ecr 1187900344], length 0
06:31:20.456086 IP switch.43030 > 192.168.101.34.35538: Flags [P.], seq 12:24, ack 1, win 0, options [nop,nop,TS val 1187905344 ecr 1437628939], length 12
06:31:20.456401 IP 192.168.101.34.35538 > switch.43030: Flags [.], ack 24, win 2085, options [nop,nop,TS val 1437633930 ecr 1187905344], length 0
06:31:25.456151 IP switch.43030 > 192.168.101.34.35538: Flags [P.], seq 24:36, ack 1, win 0, options [nop,nop,TS val 1187910344 ecr 1437633930], length 12
06:31:25.456876 IP 192.168.101.34.35538 > switch.43030: Flags [.], ack 36, win 2085, options [nop,nop,TS val 1437638930 ecr 1187910344], length 0
```
This client has been running for 5 hours and this problem has occurred, and other clients are still in normal state.
Both the client and the interactive node use EpollServerSocketChannel. What is the problem with the accidental failure of autoRead(true)?

**Comment by hyperxpro** [comment]
The information which you provided is very little to help.

**Comment by juebanlin** [comment]
> The information which you provided is very little to help.

Because the business code is complex, no more details can be provided, but the general process is similar. At present, epoll mode has been set to level mode. It seems that there is no problem

**Comment by NiteshKant** [comment]
Without getting into autoRead specifics, can you describe what are you trying to achieve?

**Comment by juebanlin** [comment]
> Without getting into autoRead specifics, can you describe what are you trying to achieve?

I have a service node and some clients, some of which send messages to the node, and the node forwards the client message to other clients. The service node uses the business queue to forward the message and judges isWriteAble. If it is false, sleep And wait in a loop. When the service node receives the message and prepares to be sent to the queue, it will set autoRead according to the capacity of the queue. This problem will occur when the forwarding traffic is relatively large, and when the autoRead switch is frequent.
