### ISSUE TITLE
Epoll does not handle all events correctly

### ISSUE THREAD

**Issue by caiiiycuk** [netty/netty#4591]
Netty version: 4.0.28.Final

I have a server that based on Netty (I'm using xitrum framework). This server is working fine for a long amount of time. But after some moment server randomly stops respond to some clients. Another strange thing is that open socket count growths. lsof prints:
```sh
sudo lsof -p 15018 | wc -l
1285
sudo lsof -p 15018 | grep "can't identify protocol"| wc -l
969
sudo lsof -p 15018 | grep "CLOSE_WAIT"| wc -l
6
sudo lsof -p 15018 | grep "ESTABLISHED"| wc -l
10
```

I does not have a test to reproduce the problem on 'fresh' started server. But I can reproduce the problem on a server that runs for a long time. I can debug this insntance.

To reproduce the error I wrote a small Java program, that opens a connection to the server and writes some garbage data. My expectation that the server will close the connection immediately. But the `problem server` doesn't close some connections.
```java
	public static void main(String[] args) throws IOException {
		BufferedReader stdin = new BufferedReader(new InputStreamReader(
				System.in));
		for (int i = 0; i < 10; i++) {
			final Socket socket = new Socket();
			socket.connect(new InetSocketAddress("10.0.0.9", 8540), 15 * 1000);
			PrintWriter out = new PrintWriter(socket.getOutputStream(), true);
			BufferedReader in = new BufferedReader(new InputStreamReader(
					socket.getInputStream()));
			out.println("quit");
			out.println();
			out.flush();

			System.out.println("Reading from " + i);
			String line = in.readLine();
			System.out.println("Readed " + line);
			socket.close();
			stdin.readLine();
		}
	}
```

In my case only 6 sockets has closed and 7th  socket is reading line forever. STDOUT:

```
Reading from 0
Readed HTTP/1.1 400 Bad Request
Reading from 1
Readed HTTP/1.1 400 Bad Request
Reading from 2
Readed HTTP/1.1 400 Bad Request
Reading from 3
Readed HTTP/1.1 400 Bad Request
Reading from 4
Readed HTTP/1.1 400 Bad Request
Reading from 5
Readed HTTP/1.1 400 Bad Request
Reading from 6
Readed HTTP/1.1 400 Bad Request
Reading from 7
//hangs up, wait forever...
```

If I started the test program again  the server will respond  with 'HTTP/1.1 400 Bad Request' for first 6 sockets and  for 7th socket the server won't respond. Looks like server does not respond only for i % 7th socket in request sequence.

I made tcpdump in wireshark format of 'good' and 'bad' requests. You can download this dumps from the link. They looks fine. https://drive.google.com/file/d/0B28AXjYMDNZsVzJpeGxhX1dvWGs/view?usp=sharing

Good:
```
No.     Time        Source                Destination           Protocol Length Info
      1 0.000000    10.0.0.201            10.0.0.9              TCP      74     48151 > 8540 [SYN] Seq=0 Win=29200 Len=0 MSS=1336 SACK_PERM=1 TSval=65989739 TSecr=0 WS=128
      2 0.000072    10.0.0.9              10.0.0.201            TCP      74     8540 > 48151 [SYN, ACK] Seq=0 Ack=1 Win=17896 Len=0 MSS=8960 SACK_PERM=1 TSval=2630873481 TSecr=65989739 WS=128
      3 0.049103    10.0.0.201            10.0.0.9              TCP      66     48151 > 8540 [ACK] Seq=1 Ack=1 Win=29312 Len=0 TSval=65989751 TSecr=2630873481
      4 0.049195    10.0.0.201            10.0.0.9              HTTP     71     Continuation or non-HTTP traffic
      5 0.049213    10.0.0.9              10.0.0.201            TCP      66     8540 > 48151 [ACK] Seq=1 Ack=6 Win=17920 Len=0 TSval=2630873494 TSecr=65989751
      6 0.049989    10.0.0.9              10.0.0.201            HTTP     133    HTTP/1.1 400 Bad Request 
      7 0.050064    10.0.0.9              10.0.0.201            TCP      66     8540 > 48151 [FIN, ACK] Seq=68 Ack=6 Win=17920 Len=0 TSval=2630873494 TSecr=65989751
      8 0.098162    10.0.0.201            10.0.0.9              HTTP     67     Continuation or non-HTTP traffic
      9 0.098217    10.0.0.9              10.0.0.201            TCP      54     8540 > 48151 [RST] Seq=1 Win=0 Len=0
     10 0.099028    10.0.0.201            10.0.0.9              TCP      66     48151 > 8540 [ACK] Seq=7 Ack=68 Win=29312 Len=0 TSval=65989763 TSecr=2630873494
     11 0.099045    10.0.0.9              10.0.0.201            TCP      54     8540 > 48151 [RST] Seq=68 Win=0 Len=0
     12 0.099102    10.0.0.201            10.0.0.9              TCP      66     48151 > 8540 [FIN, ACK] Seq=7 Ack=69 Win=29312 Len=0 TSval=65989763 TSecr=2630873494
     13 0.099112    10.0.0.9              10.0.0.201            TCP      54     8540 > 48151 [RST] Seq=69 Win=0 Len=0
```

Bad:
```
No.     Time        Source                Destination           Protocol Length Info
      1 0.000000    10.0.0.201            10.0.0.9              TCP      74     47967 > 8540 [SYN] Seq=0 Win=29200 Len=0 MSS=1336 SACK_PERM=1 TSval=65951730 TSecr=0 WS=128
      2 0.000048    10.0.0.9              10.0.0.201            TCP      74     8540 > 47967 [SYN, ACK] Seq=0 Ack=1 Win=17896 Len=0 MSS=8960 SACK_PERM=1 TSval=2630835473 TSecr=65951730 WS=128
      3 0.049187    10.0.0.201            10.0.0.9              TCP      66     47967 > 8540 [ACK] Seq=1 Ack=1 Win=29312 Len=0 TSval=65951742 TSecr=2630835473
      4 0.049426    10.0.0.201            10.0.0.9              TCP      71     47967 > 8540 [PSH, ACK] Seq=1 Ack=1 Win=29312 Len=5 TSval=65951742 TSecr=2630835473
      5 0.049442    10.0.0.9              10.0.0.201            TCP      66     8540 > 47967 [ACK] Seq=1 Ack=6 Win=17920 Len=0 TSval=2630835486 TSecr=65951742
      6 0.098454    10.0.0.201            10.0.0.9              TCP      67     47967 > 8540 [PSH, ACK] Seq=6 Ack=1 Win=29312 Len=1 TSval=65951755 TSecr=2630835486
      7 0.098498    10.0.0.9              10.0.0.201            TCP      66     8540 > 47967 [ACK] Seq=1 Ack=7 Win=17920 Len=0 TSval=2630835498 TSecr=65951755
```

I put a breakpoint into `DefaultChannelPipeline.fireChannelRead(Object msg)`. For good request messages are:
```
1. stop
msg: EpollSocketChannel - [id: 0xf1084b2c, /10.0.0.201:51677 => /10.0.0.9:8540]

stacktrace:
  DefaultChannelPipeline.fireChannelRead(Object) line: 846	
  AbstractEpollServerChannel$EpollServerSocketUnsafe.epollInReady() line: 110	
  EpollEventLoop.processReady(EpollEventArray, int) line: 322	
  EpollEventLoop.run() line: 254	
  SingleThreadEventExecutor$2.run() line: 111	
  DefaultThreadFactory$DefaultRunnableDecorator.run() line: 137	
  FastThreadLocalThread(Thread).run() line: 724 [local variables unavailable]

2. stop
msg - UnpooledUnsafeDirectByteBuf(ridx: 0, widx: 6, cap: 1024)
stacktrace:
  DefaultChannelPipeline.fireChannelRead(Object) line: 846
  EpollSocketChannel$EpollSocketChannelUnsafe(AbstractEpollStreamChannel$EpollStreamUnsafe).epollInReady() line: 831	
  EpollEventLoop.processReady(EpollEventArray, int) line: 322	
  EpollEventLoop.run() line: 254	
  SingleThreadEventExecutor$2.run() line: 111	
  DefaultThreadFactory$DefaultRunnableDecorator.run() line: 137	
  FastThreadLocalThread(Thread).run() line: 724 [local variables unavailable]	
```

For bad request there are only one breakpoint stop:
```
msg: EpollSocketChannel - [id: 0xf20a20ec, /10.0.0.201:51689 => /10.0.0.9:8540]
  DefaultChannelPipeline.fireChannelRead(Object) line: 846	
  AbstractEpollServerChannel$EpollServerSocketUnsafe.epollInReady() line: 110	
  EpollEventLoop.processReady(EpollEventArray, int) line: 322	
  EpollEventLoop.run() line: 254	
  SingleThreadEventExecutor$2.run() line: 111	
  DefaultThreadFactory$DefaultRunnableDecorator.run() line: 137	
  FastThreadLocalThread(Thread).run() line: 724 [local variables unavailable]	
```

For bad request there is no second fireChannelRead call with UnpooledUnsafeDirectByteBuf. 
As you can see i use Epoll and looks like that some epoll events are missing. For bad requests there are only one event processed in EpollEventLoop, but for good requests there are two events. But all requests should be identical.

Can someone give advice how to localize error.

**Comment by caiiiycuk** [comment]
I found problem. The problem was in my code that hang ups in one of epollEventLoop thread.

**Comment by ngocdaothanh** [comment]
:+1:
